{
  "schema_version": "1.0",
  "id": "task-042",
  "card_type": "result",
  "title": "Fix flaky timing test in parser module",
  "summary": "Replaced the sleep-based wait in the parser test with a fake clock. The flaky failure no longer reproduces and the full test suite passes.",
  "risk": "low",
  "recommended_decision": "APPROVE",
  "decision_reason": "Small, test-only change with green CI and no production code touched.",
  "next_action": "Merge the pull request.",
  "detail": {
    "overview": "The test test_parser_timeout failed intermittently on slow CI runners because it waited a fixed 0.1 seconds for the parser worker to finish. The fix injects a fake clock into the worker so the timeout path is exercised deterministically. No production module was modified.",
    "evidence": [
      "pytest: 84 passed, 0 failed (3 consecutive runs)",
      "CI pipeline run #1234 green on all platforms",
      "Reproduced the original flake 4/50 times before the fix, 0/200 after"
    ],
    "changes": [
      "tests/test_parser.py: replaced sleep-based wait with injected fake clock",
      "tests/conftest.py: added fake_clock fixture"
    ],
    "open_questions": []
  }
}
